{
  "schemaVersion": "1.0",
  "updatedAt": "2026-09-17T00:00:00Z",
  "source": "curated-seed",
  "sdks": [
    {
      "language": "JAVA",
      "version": "17.0.20.1",
      "os": "WINDOWS",
      "arch": "AMD64",
      "url": "https://github.com/adoptium/temurin17-binaries/releases/download/jdk-17.0.20.1%2B1/OpenJDK17U-jdk_x64_windows_hotspot_17.0.20.1_1.zip",
      "sha256": "e53a79c3c3d86865bd7e787903884331068e71321714ffd44f145785affc7cb0",
      "sizeBytes": 190817615,
      "lts": true,
      "eol": false,
      "license": "GPL-2.0-with-classpath-exception",
      "distribution": "Temurin",
      "vendor": "Eclipse Adoptium",
      "releaseDate": "2026-08-19"
    },
    {
      "language": "JAVA",
      "version": "21.0.12.1",
      "os": "WINDOWS",
      "arch": "AMD64",
      "url": "https://github.com/adoptium/temurin21-binaries/releases/download/jdk-21.0.12.1%2B1/OpenJDK21U-jdk_x64_windows_hotspot_21.0.12.1_1.zip",
      "sha256": "f9d6e191ab098c0d416e7d588a24420a8621cd2f4720dab2459b8b7b2d2d8b4e",
      "sizeBytes": 205073461,
      "lts": true,
      "eol": false,
      "license": "GPL-2.0-with-classpath-exception",
      "distribution": "Temurin",
      "vendor": "Eclipse Adoptium",
      "releaseDate": "2025-10-24"
    },
    {
      "language": "NODE",
      "version": "20.19.5",
      "os": "WINDOWS",
      "arch": "AMD64",
      "url": "https://nodejs.org/dist/v20.19.5/node-v20.19.5-win-x64.zip",
      "sha256": "c48159529572a5a947eef2d55d6485dfdc4ce8e67216402e2f6de52ad5d95695",
      "lts": true,
      "eol": false,
      "license": "MIT",
      "distribution": "Node.js",
      "vendor": "OpenJS Foundation",
      "releaseDate": "2025-09-03"
    },
    {
      "language": "NODE",
      "version": "22.20.0",
      "os": "WINDOWS",
      "arch": "AMD64",
      "url": "https://nodejs.org/dist/v22.20.0/node-v22.20.0-win-x64.zip",
      "sha256": "bb819d6eb8f5bfda294bbc83a7e4ec6539da67c4233d54b0d655b9248b15e29d",
      "lts": true,
      "eol": false,
      "license": "MIT",
      "distribution": "Node.js",
      "vendor": "OpenJS Foundation",
      "releaseDate": "2025-09-24"
    },
    {
      "language": "PYTHON",
      "version": "3.12.10",
      "os": "WINDOWS",
      "arch": "AMD64",
      "url": "https://www.python.org/ftp/python/3.12.10/python-3.12.10-amd64.zip",
      "sha256": "8649692de846c56a7189d6dae5c322ab20deb1b5908b6f39426b62a36f39415d",
      "lts": false,
      "eol": false,
      "license": "PSF-2.0",
      "distribution": "CPython",
      "vendor": "Python Software Foundation",
      "releaseDate": "2025-04-08"
    },
    {
      "language": "GO",
      "version": "1.22.4",
      "os": "WINDOWS",
      "arch": "AMD64",
      "url": "https://go.dev/dl/go1.22.4.windows-amd64.zip",
      "sha256": "26321c4d945a0035d8a5bc4a1965b0df401ff8ceac66ce2daadabf9030419a98",
      "sizeBytes": 76251174,
      "lts": false,
      "eol": false,
      "license": "BSD-3-Clause",
      "distribution": "Official",
      "vendor": "Google",
      "releaseDate": "2024-06-04"
    }
  ]
}